{"cumulative_budget":{"global_max_body_bytes":1610612736,"global_max_requests":200,"remaining_body_bytes":1521030130,"remaining_requests":136,"used_body_bytes":89582606,"used_requests":64},"development_bricks_sha256":"147c0942a5340ed18eec23a610f8afd5721390fad09c1da7ed01593deb40fab6","historical_probe_001":{"body_bytes":120960,"log":{"path":"oc3/resource_contract/OC3-RESOURCE-CONTRACT-PROBE-001/RESOURCE_CONTRACT_PROBE_RUN.log","sha256":"a91ef41dea95928b5d76e7e9a3eff595753a64686b1d069202406e8400a56741"},"requests":56,"retries":0,"science_pixels_decoded":0,"stage_id":"OC3-RESOURCE-CONTRACT-PROBE-001","state":"RESOURCE_CONTRACT_PROBE_PARTIALLY_RESOLVED","terminal":{"path":"oc3/resource_contract/OC3-RESOURCE-CONTRACT-PROBE-001/RESOURCE_CONTRACT_PROBE_TERMINAL.json","sha256":"a91ef41dea95928b5d76e7e9a3eff595753a64686b1d069202406e8400a56741"}},"implementation":{"amendment_path":"OC3_RESOURCE_CONTRACT_PROBE_002_AMENDMENT.md","amendment_sha256":"89d1f3a7e1c1da32641e93bdece766304895facef621588fcba0abfb5e0dd415","entrypoint_path":"oc3/oc3_resource_contract_probe002.py","entrypoint_sha256":"eabfb666735a46d472035e9b51f5cb025b4bb3065cc01ab6b1a26a007834f838","module_path":"oc3/oc3lib/resource_contract_probe002.py","module_sha256":"68d2fc1a1ea7e7c9d1b6fcfa520b78ee4e607d01ead575bfdfe5a77300fde5cb"},"parent_binding_001":{"path":"oc3/INPUTS/OC3_RESOURCE_CONTRACT_PROBE_BINDING_001.json","sha256":"fd8ebd4057ddbc32b4a0f87d65cf61772c637a08b3a7ffbd76dc76f9de80c333"},"policy":{"bulk_get":false,"concurrency":1,"durable_head_checkpoints":true,"durable_resource_checkpoints":true,"header_block_bytes":2880,"max_head_requests":14,"max_header_blocks_per_resource":16,"max_new_requests":136,"max_range_body_bytes":351360,"max_range_requests":122,"retries":0,"science_pixel_decode":false},"resources":[{"band":"g","brick":"3443m052","directory_component":"344","filename":"legacysurvey-3443m052-nexp-g.fits.fz","literal_url":"https://portal.nersc.gov/cfs/cosmo/data/legacysurvey/dr9/south/coadd/344/3443m052/legacysurvey-3443m052-nexp-g.fits.fz","max_bytes":1464527986,"product":"nexp","region":"south","resource_id":"oc3_a1c91b759ee0c92134b345dd"},{"band":"r","brick":"3443m052","directory_component":"344","filename":"legacysurvey-3443m052-nexp-r.fits.fz","literal_url":"https://portal.nersc.gov/cfs/cosmo/data/legacysurvey/dr9/south/coadd/344/3443m052/legacysurvey-3443m052-nexp-r.fits.fz","max_bytes":1464527986,"product":"nexp","region":"south","resource_id":"oc3_af43131868fe38641670dfff"},{"band":"z","brick":"3443m052","directory_component":"344","filename":"legacysurvey-3443m052-nexp-z.fits.fz","literal_url":"https://portal.nersc.gov/cfs/cosmo/data/legacysurvey/dr9/south/coadd/344/3443m052/legacysurvey-3443m052-nexp-z.fits.fz","max_bytes":1464527986,"product":"nexp","region":"south","resource_id":"oc3_129068557b1450fb5ba37206"},{"band":"g","brick":"3443m052","directory_component":"344","filename":"legacysurvey-3443m052-psfsize-g.fits.fz","literal_url":"https://portal.nersc.gov/cfs/cosmo/data/legacysurvey/dr9/south/coadd/344/3443m052/legacysurvey-3443m052-psfsize-g.fits.fz","max_bytes":1464527986,"product":"psfsize","region":"south","resource_id":"oc3_1fe01517651f979b4b35049e"},{"band":"r","brick":"3443m052","directory_component":"344","filename":"legacysurvey-3443m052-psfsize-r.fits.fz","literal_url":"https://portal.nersc.gov/cfs/cosmo/data/legacysurvey/dr9/south/coadd/344/3443m052/legacysurvey-3443m052-psfsize-r.fits.fz","max_bytes":1464527986,"product":"psfsize","region":"south","resource_id":"oc3_0ec691a4a408766d0e82fdf2"},{"band":"z","brick":"3443m052","directory_component":"344","filename":"legacysurvey-3443m052-psfsize-z.fits.fz","literal_url":"https://portal.nersc.gov/cfs/cosmo/data/legacysurvey/dr9/south/coadd/344/3443m052/legacysurvey-3443m052-psfsize-z.fits.fz","max_bytes":1464527986,"product":"psfsize","region":"south","resource_id":"oc3_92cbadc5b206cc6392947f21"},{"band":null,"brick":"3443m052","directory_component":"344","filename":"legacysurvey-3443m052-maskbits.fits.fz","literal_url":"https://portal.nersc.gov/cfs/cosmo/data/legacysurvey/dr9/south/coadd/344/3443m052/legacysurvey-3443m052-maskbits.fits.fz","max_bytes":1464527986,"product":"maskbits","region":"south","resource_id":"oc3_e74c49b3b7d7e66a77d7ea73"},{"band":"g","brick":"2478p325","directory_component":"247","filename":"legacysurvey-2478p325-nexp-g.fits.fz","literal_url":"https://portal.nersc.gov/cfs/cosmo/data/legacysurvey/dr9/north/coadd/247/2478p325/legacysurvey-2478p325-nexp-g.fits.fz","max_bytes":1464527986,"product":"nexp","region":"north","resource_id":"oc3_be55f6be3f5d0eb340dbd638"},{"band":"r","brick":"2478p325","directory_component":"247","filename":"legacysurvey-2478p325-nexp-r.fits.fz","literal_url":"https://portal.nersc.gov/cfs/cosmo/data/legacysurvey/dr9/north/coadd/247/2478p325/legacysurvey-2478p325-nexp-r.fits.fz","max_bytes":1464527986,"product":"nexp","region":"north","resource_id":"oc3_179cc297dddaee76b85ef6f8"},{"band":"z","brick":"2478p325","directory_component":"247","filename":"legacysurvey-2478p325-nexp-z.fits.fz","literal_url":"https://portal.nersc.gov/cfs/cosmo/data/legacysurvey/dr9/north/coadd/247/2478p325/legacysurvey-2478p325-nexp-z.fits.fz","max_bytes":1464527986,"product":"nexp","region":"north","resource_id":"oc3_6ea12d3dfedb57cb4694e64c"},{"band":"g","brick":"2478p325","directory_component":"247","filename":"legacysurvey-2478p325-psfsize-g.fits.fz","literal_url":"https://portal.nersc.gov/cfs/cosmo/data/legacysurvey/dr9/north/coadd/247/2478p325/legacysurvey-2478p325-psfsize-g.fits.fz","max_bytes":1464527986,"product":"psfsize","region":"north","resource_id":"oc3_d35bb2a6ae443de63c3fb3b4"},{"band":"r","brick":"2478p325","directory_component":"247","filename":"legacysurvey-2478p325-psfsize-r.fits.fz","literal_url":"https://portal.nersc.gov/cfs/cosmo/data/legacysurvey/dr9/north/coadd/247/2478p325/legacysurvey-2478p325-psfsize-r.fits.fz","max_bytes":1464527986,"product":"psfsize","region":"north","resource_id":"oc3_6906a01044621a558c9b6cde"},{"band":"z","brick":"2478p325","directory_component":"247","filename":"legacysurvey-2478p325-psfsize-z.fits.fz","literal_url":"https://portal.nersc.gov/cfs/cosmo/data/legacysurvey/dr9/north/coadd/247/2478p325/legacysurvey-2478p325-psfsize-z.fits.fz","max_bytes":1464527986,"product":"psfsize","region":"north","resource_id":"oc3_331684f0c7ab9b77c866cbfa"},{"band":null,"brick":"2478p325","directory_component":"247","filename":"legacysurvey-2478p325-maskbits.fits.fz","literal_url":"https://portal.nersc.gov/cfs/cosmo/data/legacysurvey/dr9/north/coadd/247/2478p325/legacysurvey-2478p325-maskbits.fits.fz","max_bytes":1464527986,"product":"maskbits","region":"north","resource_id":"oc3_6bfe8bca2e2c040feb91bcd2"}],"schema_version":"OC3_DR9_COADD_RESOURCE_PROBE_BINDING_002","sealed":"ff71883fe3f049674174551889c8701a84edacb83ec03b77cb3914957689d3f1","stage_id":"OC3-RESOURCE-CONTRACT-PROBE-002"}
